{
  "schema_version": 1,
  "trainer_id": "ai-toolkit-ltx",
  "manifest_path": "runs/seinfeld-dataset/ai-toolkit-ltx.manifest.json",
  "vocabulary_path": "astrid/packs/seinfeld/vocabulary.yaml",
  "compute": {
    "backend": "runpod",
    "gpu_type": "NVIDIA RTX 6000 Ada Generation",
    "container_disk_gb": 200,
    "max_runtime_seconds": 43200,
    "max_gpu_hours": 12,
    "max_runpod_spend_usd": 15,
    "require_spend_confirmation": true,
    "storage_name": "seinfeld-dataset",
    "image": "ostris/aitoolkit:latest",
    "ports": "8675/http,22/tcp"
  },
  "secrets": {
    "required_env": ["RUNPOD_API_KEY", "HF_TOKEN"]
  },
  "base_model": "Lightricks/LTX-2.3/ltx-2.3-22b-dev.safetensors",
  "lora_config": {
    "lora_id": "seinfeld-scene-v1",
    "trigger_word": "seinfeld scene",
    "prompt_text": "90s multicam sitcom scene with locked-off studio camera, practical apartment or diner set lighting, and conversational blocking.",
    "rank": 32,
    "alpha": 32,
    "steps": 2000,
    "learning_rate": 0.00002,
    "seed": 42,
    "width": 512,
    "height": 768,
    "num_frames": 121,
    "fps": 24,
    "batch_size": 1,
    "gradient_accumulation_steps": 4,
    "save_every": 250,
    "sample_every": 250
  },
  "checkpoint": {
    "enabled": true,
    "sample_prompts": [
      "seinfeld scene, a medium shot in a sitcom apartment set with two characters talking",
      "seinfeld scene, a wide shot in a bright diner booth with expressive conversation"
    ],
    "review_labels": [
      "character consistency",
      "sitcom staging",
      "caption alignment",
      "motion stability"
    ]
  },
  "output": {
    "run_dir": "runs/seinfeld-lora"
  }
}
